status_id,Date,text,relevant_ra
1321213326488150017,2020-10-27T00:00:00Z,the people who do mission trips &amp; take pics for their social media w impoverished african kids w the caption “missing my best friends” are the same people who say BLM is a terrorist org and actually think trump has done more for black people since lincoln (i don’t make the rules),0.0
1261448026339434496,2020-05-16T00:00:00Z,"What’s the point of a comprehensive Community Standards policy if you can’t enforce them?  Maharlika’s post with Kath’s picture undeniably violates the CS guidelines under Objectionable Content (Tier 2 Hate Speech) yet nothing has been done about it @Facebook.

#WeBlockAsOne https://t.co/ECwiHqNUEp",1.0
1280144723458441216,2020-07-06T00:00:00Z,"#AsimRiazBirthdayIn1Week
Guys my main account got suspended due to the striking from the enemy fandom one month before.

I want it back. Apart from adding phone number.what should I do to get it back.

Please help.
#AsimRiaz #AsimSquad #Asimians 
@IamAsimRiaz1 @_kritikaRao_ https://t.co/FO8QquEKuL",1.0
1274035505353691136,2020-06-19T00:00:00Z,"Katie Hopkins permanently suspended from Twitter for violating its hateful conduct policy, the social media giant says https://t.co/qUSkmfn6FM",1.0
1250275486200025091,2020-04-15T00:00:00Z,"""This is Federalism 101,"" said @BobbyChesney.  ""The president can advocate to his heart’s content, but he can’t actually commandeer the state governments to make them change their policies. He has no such inherent authority."" https://t.co/mSddsS8GG2",0.0
1217459195257278464,2020-01-15T00:00:00Z,"This is Mimi the blogger’s (@mdaixo__) mini breakdown on @stormzy since her account got suspended.

Stormzy - Being a Role Model Isn’t Always a Choice, the crown is indeed heavy: The Breakdown edition

Like, Share and Retweet! Let me know what you think.

https://t.co/yBo5MBuuAO",1.0
1278716765212680192,2020-07-02T00:00:00Z,"can you believe this? @elderofziyon account one of the best and fairest Israel advocates on social media has been suspended. is any more proof needed that @twitter is in the hands of extremist anti-Israel plo supporters? reinstate the account @twittersupport @jack 

#USA #Israel https://t.co/YRGdT38aML",1.0
1277874692129357825,2020-06-30T00:00:00Z,"Twitter is openly against US President.
Twitch posting Media suspended the account of Trump.
Hollywood and Pop celebrities are against him.

Media were obviously never in favour of Trump.

But trump is still enjoying support from country area and non-coastal states.

50-50 chance",1.0
1246818602038095872,2020-04-05T00:00:00Z,"Hello 
@Twitter @TwitterSupport
I've been following 
@VJ12301230
@endingandstart
@lTU12nsDXsSpLAN
@TAESUPREMACY
for a long time and I saw this account got suspended for no reason. The owner of this account never violated any of Twitter rules. Please bring back their account",1.0
1239555124076220416,2020-03-16T00:00:00Z,FOR GUIDANCE: Here are the guidelines under President Rodrigo Duterte's order for Enhanced Community Quarantine response to COVID-19. | via @edupunay https://t.co/zmi0zJcP4h,0.0
1216307547289915400,2020-01-12T00:00:00Z,These are a few pics from a photo gallery I just uploaded to https://t.co/XE3qokgxT3. They're from a short video that is FREE for you to view on the Homepage of the website. It was supposed to go on my https://t.co/cTLAa6Wuhs account which is still blocked. Check it out!  https://t.co/dG0C4MK7cU,0.0
1288323055857610752,2020-07-29T00:00:00Z,@bananaicepuff YEAH... im just hoping thats the extent of his actions and that it wont go any farther... its strange that on his other account his header is that someone blocked him and that he tweets about it too like .............,0.0
1289377862580080641,2020-08-01T00:00:00Z,"David Duke's account was suspended by Twitter. Trump has not commented, but it's reasonably safe to assume he wishes David well.",1.0
1316672327908638720,2020-10-15T00:00:00Z,@KamaCasino your team  blocked my account when my opponent play buff which is in my friend list in this what is my fault  please pay attention  account name :-evershine,0.0
1275251865517686784,2020-06-23T00:00:00Z,“The US president extended a ban on green card applications until the end of the year and suspended a range of “guest worker” visas that allow everyone from scientists and engineers to au pairs to work in the US.” https://t.co/cnzyRNZPRf,0.0
1241440892633976839,2020-03-21T00:00:00Z,"Stop complaining about Trump.  

Hold to account the Senators who refused to remove him while a fatal pandemic was allowed to spread and kill Americans.",0.0
1318158391299182594,2020-10-19T00:00:00Z,Facebook and Instagram have banned his account after shadowbanning proved ineffective. #freespeech @TeamSaveAmerica https://t.co/uXA38bHLrO,1.0
1261063670211268610,2020-05-14T00:00:00Z,So I called Chris Hay3s a fear mongering whore on March 27 and my account was suspended.,1.0
1267240220799438850,2020-05-31T00:00:00Z,"Hey lovelies! I’m sure most of you know @_etherealsouls , who is a amazing Artist and Person. Her account was suspended for sharing her opinions on BLM, which is simply unconstitutional. We have a chance to appeal this suspension, I will put the link down below.",1.0
1232641024771543042,2020-02-26T00:00:00Z,"@TheKenWeb The first cut of the platform is expected to come by August. Critics say it's at least one year away from completion. Today, drone services companies are making the rounds of DGCA to seek exemptions from the 2018 drone policy",0.0
1212243849285779456,2020-01-01T00:00:00Z,the decade is about to end so let's not forget the moment that shaped it  https://t.co/GjLNqtC7BH,0.0
1220910768587018240,2020-01-25T00:00:00Z,"Just let Addien be a normal twitter user who tweets normal stuff. He never branded himself as an ustaz pun, just someone who shares the knowledge that he knows. If you wanna benefit from it, it's free. If you hate to see it, mute or block. Let a man live fgs",0.0
1227301447815114755,2020-02-11T00:00:00Z,https://t.co/cVdWmyu5HN,0.0
1250598449197617152,2020-04-16T00:00:00Z,"I've said it before, I'll say it again: 
If you want your content to remain IN EXISTENCE, make sure you have local copies. I don't care how good you think a host is: they can and will delete it when they chance policies or go out of business or whatever. https://t.co/nOAVtLx9Qu",1.0
1296505898697981958,2020-08-20T00:00:00Z,"RW Sanghis supporting the abusive 'Hindustani Bhau' &amp; questioning the removal of his Instagram account tells you everything you need to ever know about the mindset of these people.

They are just sickos.

Remember, PM Modi follows handles that have given rape &amp; death threats.",1.0
1225827273774944257,2020-02-07T00:00:00Z,"""I’ll just say it this way: The fate of the world depends on the Democrats getting their shit together and winning in November. We have to beat Trump."" Carville has the rare gift of being able to speak in plainer English than most writers can write.
 https://t.co/HPvdytp3zR",0.0
1221223129164537857,2020-01-26T00:00:00Z,"@A_Silent_Child Obviously just a troll account, and can see theyve been banned and suspended before... but yup i’m on it to get them banned again",1.0
1271399364137750531,2020-06-12T00:00:00Z,"Dear consumers of the USA! Do you know that your rights may be taken away from you by the US Senate?  
The Senate wants to limit your freedom of speech.
We, at @pissedconsumer, need to stand together with millions of people on defending Section 230.
https://t.co/eXxY4DHawN",1.0
1295265602806747137,2020-08-17T00:00:00Z,had to post it like this so hopefully my account wont get taken down...,1.0
1224432862490808321,2020-02-03T00:00:00Z,"Ms Rempel should examine her own house too, &amp; not block Canadians from viewing &amp; replying to tweets from her verified Twitter account, &amp; not shut down respectful dialogue by blocking so many Canadians

She won’t get this message from me, directly, b/c I’m one of the 1000s blocked https://t.co/8bYvOiOqAE",0.0
1316750344366551040,2020-10-15T00:00:00Z,"The official Trump campaign Twitter account has been suspended, 18 days before Election Day, because the woke corporation decided it didn’t like the story about Hunter Biden.

And the left is out here seriously claiming it’s Trump that’ll try to cheat  https://t.co/O64xB1tQKb",1.0
1287734698576236544,2020-07-27T00:00:00Z,"That's where it should be. Stealing is wrong and needs to be rectified. Original content rules.
#TheNaamIsSaariKiSaari https://t.co/WEar2w97rW",0.0
1298068361293598720,2020-08-25T00:00:00Z,"Hi, my discord account (nathanius5#4933) just got banned and I lost a few good thinks I really can't live without. I lost @SytheIO LT, @OrbitRestocks LT, @FattyeXtension af and aco, @feature and that's all I can think of now... 

Pls retweet so I can get my things back",1.0
1223397778899886080,2020-02-01T00:00:00Z,Mr. McCullough is so young that he doesn't remember the Canadian content rules that governed radio in the 70s and which fuelled a generation of Canadian music that found success internationally. #cdnpoli https://t.co/1ECOWJcasU,0.0
1230236031397572608,2020-02-19T00:00:00Z,"Citation:
https://t.co/d4cpC9WPk0 https://t.co/lCF3FqKOjS I don’t endorse Republicans. https://t.co/uQMjLdxHA3",0.0
1278150797273038848,2020-07-01T00:00:00Z,"Not content with retweeting a follower shouting “white power,” Trump is now boasting about possibly overturning fair housing rules. https://t.co/lFhMoiAMzs",0.0
1283669606201036801,2020-07-16T00:00:00Z,"Twitters admin panel has a button to “blacklist trends.”

So yeah twitter lied, they manually edit trends. The ones advocating violence are kept up. By their choice.

They aren’t a platform. They are a publisher. 

Abolish Section 230.",1.0
1321803832225980416,2020-10-29T00:00:00Z,"Important Alert 

Many Accounts Are Getting Suspended Due To Authentication Code. If We Don't Have Authentication Code Is There Any Other Way To Get Back Account  ?? 

Anyone Knows Please Comment Many Co Fans Need It 

#SarkaruVaariPaata https://t.co/lBPkUgvn5h",1.0
1312195325461839872,2020-10-03T00:00:00Z,I pledge to be safe online https://t.co/e4AkcGIFIA #SafetyPledge #OnlineSafety,0.0
1316646692742197249,2020-10-15T00:00:00Z,"jack speaking up about the movement might just mean this app is clear 

make e no ever suspend my account sha because na there we go get problem",1.0
1259721747399618562,2020-05-11T00:00:00Z,"people be acting so shocked when they’re blocked 
asshole: “I hate you, you’re so annoying, you’re ugly”
me: *block*
asshole on another account: “omg why would you block me?! I was just giving my opinion wtf ”",0.0
1247997796256366592,2020-04-08T00:00:00Z,"Important part of this Sanders livestream: ""I will stay on the ballot in all remaining states and continue to gather delegates."" Concedes to Biden, not releasing delegates, and holding out hope of a big enough delegate bloc to influence platform/primary rules.",0.0
1296796000867110912,2020-08-21T00:00:00Z,Girl it’s obvious too I’m next in line to block lol clearly created as a backup account to talk even more mess. Fake fans to the left and the right. Birds of a feather  https://t.co/l6zfXHGBXA,0.0
1311744014912192526,2020-10-01T00:00:00Z,Hey @Twitter why you suspended my son's account @Borregales_andy ? #freeAndy ,1.0
1267906125405528067,2020-06-02T00:00:00Z,We are nothing without Black lives.   There's no room for injustice. We commit to strengthening every facet of our culture and policies to foster an environment where equality for Black people is a priority. We'll use our platform to support this movement. #BlackLivesMatter,0.0
1224407636541673472,2020-02-03T00:00:00Z,"'Young people in Northern Ireland have been learning the dangers of online scams thanks to a new initiative.'

#SaferInternetDay #OnlineSafety

https://t.co/EYtcKSCPbF",0.0
1224403448466001922,2020-02-03T00:00:00Z,"Dangerous stuff here. This isn’t even the equivalent of jaywalking. Have to wonder if a certain popular journo tournament Smug was running had anything to do w/this: Comfortably Smug’ Twitter Account Banned For Asking ‘Where’s Hunter, Fat?’ - Daily Caller https://t.co/zIGHpkWm0h",1.0
1289992462270738438,2020-08-02T00:00:00Z,"@MelvinPN @swimmerbr78 This why. Doubt many think Trump is great. But he gives ppl a choice instead of one being made for them. We can do better but there isn’t an option. Still is the lesser of two evils. 
https://t.co/rXFS3UK0oG",0.0
1263623396602122240,2020-05-22T00:00:00Z,"Andile Mgxitama's account has been suspended again...

•BLF Website and Facebook account have been shutdown previously 
•Views on black consciousness are not allowed on Twitter and other social networks/media platforms 
•There isn't a black owned social media platform https://t.co/se8hSe1Bu9",1.0
1299271939312300032,2020-08-28T00:00:00Z,"Hey @TwitterSupport , why don’t you suspend russian propaganda accounts, but instead you’ve suspended pure Ukrainian account @myrotvorets_? 
Please, reinstate this account ASAP! https://t.co/0lxtX0Tqfi",1.0
